{
  "$schema": "../.td2d/schemas/palette.schema.json",
  "schemaVersion": "1.0.0",
  "name": "heraldry",
  "description": "Hue-shifted ramps for the knight: cool steel, warm gold, royal blue, crimson and leather, with one shared outline colour.",
  "colors": [
    "#14101e",
    "#2a2f4a",
    "#434c6e",
    "#66739a",
    "#93a3c4",
    "#c6d2e6",
    "#f2f6ff",
    "#5a2a1e",
    "#8e4a1f",
    "#c87f22",
    "#f0b632",
    "#ffe27a",
    "#fff7c8",
    "#10173f",
    "#19307a",
    "#2552b5",
    "#3a7ee0",
    "#79b6ff",
    "#2e0e1e",
    "#5e1427",
    "#9a1f33",
    "#d63445",
    "#ff6b62",
    "#3a2026",
    "#6b3a2f",
    "#9a5e3f"
  ]
}
