{
  "schemaVersion": "1.0.0",
  "name": "pico-8",
  "description": "The 16-colour PICO-8 fantasy console palette.",
  "source": "https://lospec.com/palette-list/pico-8",
  "colors": [
    "#000000",
    "#1d2b53",
    "#7e2553",
    "#008751",
    "#ab5236",
    "#5f574f",
    "#c2c3c7",
    "#fff1e8",
    "#ff004d",
    "#ffa300",
    "#ffec27",
    "#00e436",
    "#29adff",
    "#83769c",
    "#ff77a8",
    "#ffccaa"
  ]
}
